{
  "schema_version": "disease-product-scenario-script/v1",
  "meta": {
    "theme_id": "theme.test.neutral-a",
    "gold_sample": false,
    "organization": "示例连锁培训中心",
    "brand_label": "示例连锁 · 内部培训",
    "internal_notice": "中性引擎验收样例 · 非业务发布稿",
    "source_notes": [
      "本文件为引擎中性换题验收样例，所有名称与字段均为虚构演示。",
      "正式使用时，疾病、商品、场景、话术与图片须由业务资料及审核结果替换。"
    ]
  },
  "pages": {
    "cover": {
      "title": "示例证候A与示例商品A门店培训",
      "eyebrow": "疾病认知 · 商品知识 · 场景演练",
      "subtitle": "用统一框架完成从认知到沟通的培训闭环",
      "prepared_line": "课程类型：门店业务培训 · 数据驱动中性样例",
      "image": "../assets/placeholders/packshot.png",
      "image_alt": "由中性测试输入指定的示例商品包装图",
      "source_refs": [
        "封面标题、商品名和图片路径均来自本输入文件。"
      ]
    },
    "opening": {
      "section": "导入",
      "title": "为什么要把疾病、商品与场景连起来",
      "kicker": "一次培训，解决三个一线问题",
      "headline": "先理解，再匹配，最后把话说清楚",
      "pillars": [
        {
          "title": "识别信息",
          "body": "从顾客描述中提取经过审核的关键字段。"
        },
        {
          "title": "匹配资料",
          "body": "只依据商品资料与适用边界做信息匹配。"
        },
        {
          "title": "完成沟通",
          "body": "用清晰、可复核的话术完成说明与提醒。"
        }
      ],
      "quote": "标准流程不是背答案，而是让每一步都有依据。"
    },
    "agenda": {
      "section": "目录",
      "title": "课程目录"
    },
    "disease_definition": {
      "section": "1.1",
      "title": "疾病篇——示例证候A是什么",
      "image": "../assets/placeholders/disease.png",
      "image_alt": "由中性测试输入指定的状态示意图"
    },
    "symptoms": {
      "section": "1.2",
      "title": "疾病篇——常见信息表现"
    },
    "comparison": {
      "section": "1.3",
      "title": "疾病篇——相似信息对比",
      "footer": "门店沟通先核对信息，不用单一表现替代完整判断。"
    },
    "treatment": {
      "section": "1.4",
      "title": "疾病篇——处理原则框架"
    },
    "subtypes": {
      "section": "1.5",
      "title": "疾病篇——信息分型示例"
    },
    "product_info": {
      "section": "2.1",
      "title": "商品篇——示例商品A基础资料"
    },
    "advantages": {
      "section": "2.2",
      "title": "商品篇——资料内核心特点"
    },
    "product_summary": {
      "section": "2.3",
      "title": "商品篇——一页记住重点"
    },
    "audience": {
      "section": "3.1",
      "title": "人群篇——重点沟通对象"
    },
    "consultation": {
      "section": "3.2",
      "title": "人群篇——门店咨询四步法"
    },
    "daily_care": {
      "section": "4.3",
      "title": "场景篇——日常建议表达"
    },
    "weighted_comparison": {
      "section": "5.2",
      "title": "权重篇——示例商品横向比较"
    }
  },
  "agenda": [
    {
      "number": "01",
      "title": "疾病认知",
      "subtitle": "定义、表现、对比与处理框架"
    },
    {
      "number": "02",
      "title": "商品资料",
      "subtitle": "基础字段、特点与重点总结"
    },
    {
      "number": "03",
      "title": "重点人群",
      "subtitle": "沟通对象与咨询步骤"
    },
    {
      "number": "04",
      "title": "场景演练",
      "subtitle": "完整对话与日常建议"
    },
    {
      "number": "05",
      "title": "权重商品",
      "subtitle": "单品信息与横向比较"
    }
  ],
  "disease": {
    "name": "示例证候A",
    "definition": "示例证候A是本次引擎验收使用的虚构训练主题，用于验证定义、表现、分型和场景内容能否由输入完整替换。",
    "definition_tags": [
      "信息来源可追溯",
      "字段由业务提供",
      "结论须经审核",
      "表达保持一致"
    ],
    "symptoms": [
      {
        "name": "表现字段A1",
        "description": "顾客主动描述的第一类演示信息，门店需继续询问上下文。",
        "image": "../assets/placeholders/packshot.png",
        "image_alt": "输入指定的表现字段A1示意图"
      },
      {
        "name": "表现字段A2",
        "description": "与活动或作息相关的第二类演示信息，不单独形成结论。",
        "image": "../assets/placeholders/packshot.png",
        "image_alt": "输入指定的表现字段A2示意图"
      },
      {
        "name": "表现字段A3",
        "description": "需要核对持续时间与变化趋势的第三类演示信息。",
        "image": "../assets/placeholders/packshot.png",
        "image_alt": "输入指定的表现字段A3示意图"
      },
      {
        "name": "表现字段A4",
        "description": "与工作场景相关的第四类演示信息，记录后再进入下一步。",
        "image": "../assets/placeholders/packshot.png",
        "image_alt": "输入指定的表现字段A4示意图"
      }
    ],
    "comparison": {
      "columns": [
        "对比维度",
        "示例证候A",
        "相似主题B"
      ],
      "rows": [
        [
          "信息起点",
          "由字段A组触发",
          "由字段B组触发"
        ],
        [
          "常见描述",
          "偏向A类表达",
          "偏向B类表达"
        ],
        [
          "核对重点",
          "时间、变化与关联信息",
          "情境、频次与伴随信息"
        ],
        [
          "处理边界",
          "资料不足时继续询问",
          "超出范围时建议转介"
        ]
      ]
    },
    "treatment_principles": [
      {
        "title": "原则A｜先核对",
        "body": "先确认顾客表达的字段是否完整，再进入商品资料说明。"
      },
      {
        "title": "原则B｜看边界",
        "body": "明确门店沟通范围，遇到风险信息及时停止常规推荐。"
      },
      {
        "title": "原则C｜用证据",
        "body": "商品信息只使用已提供、已审核、可追溯的资料。"
      },
      {
        "title": "原则D｜讲清楚",
        "body": "把适用信息、注意事项和下一步行动说得具体。"
      },
      {
        "title": "原则E｜做记录",
        "body": "对关键问答和业务确认项保留可复核记录。"
      },
      {
        "title": "原则F｜再确认",
        "body": "沟通结束前确认顾客已经理解重点与边界。"
      }
    ],
    "subtypes": [
      {
        "name": "A型信息",
        "features_label": "特点",
        "features": "字段A1与A2同时出现。",
        "approach_label": "处理",
        "approach": "按A型问询清单补充资料。"
      },
      {
        "name": "B型信息",
        "features_label": "特点",
        "features": "字段A3更突出且持续变化。",
        "approach_label": "处理",
        "approach": "先核对风险项，再决定后续流程。"
      },
      {
        "name": "C型信息",
        "features_label": "特点",
        "features": "工作情境与作息信息明显。",
        "approach_label": "处理",
        "approach": "同步给出经过审核的日常建议。"
      },
      {
        "name": "D型信息",
        "features_label": "特点",
        "features": "信息不完整或表达矛盾。",
        "approach_label": "处理",
        "approach": "停止推断，补充信息或建议转介。"
      }
    ]
  },
  "product": {
    "name": "示例商品A",
    "image": "../assets/placeholders/packshot.png",
    "image_alt": "由中性测试输入指定的示例商品A包装图",
    "badges": [
      "资料字段齐全",
      "审核口径一致",
      "场景表达可复核"
    ],
    "information": [
      {
        "label": "商品名称",
        "value": "示例商品A",
        "emphasis": true
      },
      {
        "label": "演示规格",
        "value": "规格字段A"
      },
      {
        "label": "演示剂型",
        "value": "剂型字段A"
      },
      {
        "label": "资料版本",
        "value": "内部审核样例版"
      },
      {
        "label": "适用信息",
        "value": "以业务确认字段为准"
      },
      {
        "label": "注意事项",
        "value": "按审核资料完整表达"
      }
    ],
    "advantages": [
      {
        "title": "特点A｜资料清晰",
        "body": "基础字段按统一结构呈现，方便门店快速检索。"
      },
      {
        "title": "特点B｜重点集中",
        "body": "将已审核的重点压缩成可记忆、可复述的信息块。"
      },
      {
        "title": "特点C｜边界明确",
        "body": "适用信息与注意事项在同一页完成对应。"
      },
      {
        "title": "特点D｜场景可用",
        "body": "商品资料能够直接进入完整问询与说明场景。"
      }
    ],
    "summary": {
      "headline": "记住商品资料，也记住资料的使用边界",
      "groups": [
        {
          "title": "必须说清",
          "items": [
            "商品名称与规格",
            "适用信息字段",
            "注意事项字段",
            "资料版本来源"
          ]
        },
        {
          "title": "必须问到",
          "items": [
            "顾客当前描述",
            "已知使用信息",
            "变化趋势与风险项",
            "是否需要转介"
          ]
        },
        {
          "title": "必须避免",
          "items": [
            "脱离资料补写结论",
            "跳过问询直接推荐",
            "省略注意事项",
            "把演示稿当正式审核稿"
          ]
        }
      ]
    },
    "audience": [
      {
        "title": "重点人群A",
        "body": "首次咨询、对商品资料不了解，需要完整说明的人群。",
        "image": "../assets/placeholders/packshot.png",
        "image_alt": "输入指定的重点人群A示意图"
      },
      {
        "title": "重点人群B",
        "body": "有既往使用信息，需要先核对资料再沟通的人群。",
        "image": "../assets/placeholders/packshot.png",
        "image_alt": "输入指定的重点人群B示意图"
      },
      {
        "title": "重点人群C",
        "body": "表达不完整或存在风险项，需要谨慎处理的人群。",
        "image": "../assets/placeholders/packshot.png",
        "image_alt": "输入指定的重点人群C示意图"
      }
    ],
    "consultation": [
      {
        "step": "问",
        "title": "听清当前描述",
        "question": "请问目前最想解决的具体问题是什么？"
      },
      {
        "step": "查",
        "title": "核对关键信息",
        "question": "相关信息从什么时候开始，最近有怎样的变化？"
      },
      {
        "step": "讲",
        "title": "依据资料说明",
        "question": "我按已审核资料为您说明商品字段与注意事项。"
      },
      {
        "step": "确",
        "title": "确认理解与行动",
        "question": "这些重点是否清楚，下一步需要我再说明哪一项？"
      }
    ],
    "scenarios": [
      {
        "section": "4.1",
        "page_title": "场景篇——首次咨询",
        "title": "场景一：信息不完整时如何推进",
        "profile_label": "顾客背景",
        "profile": "顾客甲首次到店，只描述了表现字段A1，希望直接获得商品建议。",
        "needs_label": "沟通目标",
        "needs": "先补充关键信息，再使用商品资料完成说明。",
        "recommendation_label": "本场景训练重点",
        "recommendation": "不补写结论，不跳过问询，不省略资料边界。",
        "dialogues": [
          {
            "role": "customer",
            "speaker": "顾客甲",
            "text": "我最近有表现字段A1，想了解一下有什么合适的信息。"
          },
          {
            "role": "staff",
            "speaker": "店员",
            "text": "我先了解一下：这个情况从什么时候开始，最近有没有变化？"
          },
          {
            "role": "customer",
            "speaker": "顾客甲",
            "text": "大约从本周开始，工作忙的时候更明显。"
          },
          {
            "role": "staff",
            "speaker": "店员",
            "text": "明白了。我再核对几个风险项，然后按已审核资料为您介绍示例商品A。"
          }
        ],
        "source_refs": [
          "本页全部人物背景与对话来自 product.scenarios[0]。"
        ]
      },
      {
        "section": "4.2",
        "page_title": "场景篇——复购沟通",
        "title": "场景二：已有使用信息时如何核对",
        "profile_label": "顾客背景",
        "profile": "顾客乙曾了解示例商品A，本次希望再次确认资料与注意事项。",
        "needs_label": "沟通目标",
        "needs": "核对既往信息、当前变化与审核资料版本。",
        "recommendation_label": "本场景训练重点",
        "recommendation": "先确认变化，再复述资料，并让顾客确认已经理解。",
        "dialogues": [
          {
            "role": "customer",
            "speaker": "顾客乙",
            "text": "我之前了解过示例商品A，这次想再确认一下。"
          },
          {
            "role": "staff",
            "speaker": "店员",
            "text": "可以。先请问您目前的信息与上次相比有没有变化？"
          },
          {
            "role": "customer",
            "speaker": "顾客乙",